{
  "fixture_level": "contract_fixture",
  "id": "gtw.missile_guidance.fixture.stage_i10",
  "kind": "MissileGuidanceProfileCatalog",
  "name": "阶段I10·导弹制导状态技术替身配置",
  "profiles": [
    {
      "activation_distance_m": 3000.0,
      "allowed_height_layers": [
        "upper",
        "cloud",
        "rain"
      ],
      "launch_support": "optional_fire_control",
      "maximum_lateral_acceleration_mps2": 60.0,
      "munition_id": "gtw.munition.fixture.76mm.standard",
      "name": "阶段I10·主动雷达制导状态技术替身",
      "seeker_kind": "active_radar",
      "seeker_search_range_m": 5000.0,
      "self_destruct_delay_s": 5.0,
      "target_loss_behavior": "last_known_position_then_self_destruct",
      "target_memory_s": 2.0
    }
  ],
  "schema": "gaotian.missile-guidance/v1alpha1",
  "version": 1
}
